"ChangeID","dateAdded","datemodified","Fname","UserID","ChangeType","Description","ModifiedUserid","Status","ScreenShot","SentFromCompany","SentFromDivision","Sent"
"95","2011-12-19 12:58:03","2011-12-19 12:59:15","frmLeaveMan - Leave Management","1","Bug","Leave management crashes the system on most of the buttons.  Even when selecting an individual person when clicking on close it crashes, when clicking on the cog it crashes the system.","1","Waiting for approval","unknown_value_please_contact_support","","","0"
"96","2011-12-19 16:15:05","2011-12-19 16:15:28","frmContractDetails - Contract details","1","Bug","When you select the options button the system crashes.","1","Waiting for approval","unknown_value_please_contact_support","","","0"
"97","2011-12-19 16:17:43","2011-12-19 16:18:19","frmApptPrint - Print Appointments","1","Change Request","When print preview daily appointments it only pulls through some of the information not all","1","Waiting for approval","unknown_value_please_contact_support","","","0"
"98","2011-12-19 16:25:56","2011-12-19 16:26:30","frmSupplierDetails - Supplier Details   [ Testing Louise ]","1","Bug","Print client details report - preview, this option crashes the system","1","Waiting for approval","unknown_value_please_contact_support","","","0"
"99","2011-12-20 11:46:13","2011-12-20 11:46:48","frmProjectDetails - Project Details","1","Change Request","Expense tab - the new tab does not action anything","1","Waiting for approval","unknown_value_please_contact_support","","","0"
"100","2011-12-20 16:09:16","2011-12-20 16:10:20","frmAuditTrail - Manage Audit Trail","1","Change Request","The list view for e-mail tab is not pulling through any information (no e-mails that were linked on the company documents tab pulls through","1","Waiting for approval","unknown_value_please_contact_support","","","0"
"101","2011-12-22 10:14:46","2011-12-22 10:16:35","frmAccCostEstimateDetails - Quote Details[528654] - Created by: Admin Admin","1","Change Request","The zero values of the sub-components pulls through to the quote template","1","Waiting for approval","unknown_value_please_contact_support","","","0"
"102","2011-12-22 10:26:37","2011-12-22 10:30:17","frmLeadManager - Lead Manager","1","Bug","If you want to export a lead and you click on tick box on the left it does not justb pull through the one lead but all the leads","1","Waiting for approval","unknown_value_please_contact_support","","","0"
"103","2011-12-22 10:37:08","2011-12-22 10:37:47","frmLeadDetails - Lead Details","1","Bug","print Preview on lead details opens up ablank template","1","Waiting for approval","unknown_value_please_contact_support","","","0"
"104","2011-12-22 11:56:22","2011-12-22 11:57:10","frmCanvassingDetails - Canvass Details[This Canvass has be converted to a Lead{LeadID:87}]","1","Bug","When converting a canvas to a lead it does not pull through to the lead manager list view","1","Waiting for approval","unknown_value_please_contact_support","","","0"
